{
  "$schema": "https://json-schema.org/draft/2020-12/schema",
  "type": "object",
  "properties": {
    "window_id": {
      "type": "string"
    },
    "folds": {
      "anyOf": [
        {
          "type": [
            "string",
            "number",
            "boolean",
            "null"
          ]
        },
        {
          "type": "object",
          "propertyNames": {
            "type": "string"
          },
          "additionalProperties": {}
        },
        {
          "type": "array",
          "items": {}
        }
      ]
    },
    "protocol_sha256": {
      "type": "string"
    },
    "frozen_at_utc": {
      "type": "string",
      "pattern": "^\\d{4}-\\d{2}-\\d{2}T\\d{2}:\\d{2}:\\d{2}(\\.\\d+)?Z$"
    }
  },
  "required": [
    "window_id",
    "folds",
    "protocol_sha256",
    "frozen_at_utc"
  ],
  "additionalProperties": false
}
