[{"window_id":"nfl_games_v1","folds":{"burn_in":{"seasons":[2010,2011,2012,2013,2014,2015,2016,2017],"use":"training history for blends and calibrators; never scored"},"tune":{"seasons":[2018,2019,2020,2021,2022],"use":"select hyperparameters and blend weights on out-of-fold predictions"},"confirm":{"seasons":[2023,2024],"use":"first honest comparison; no tuning"},"holdout":{"seasons":[2025],"sealed":true,"use":"scored once, after C3 (Phase 1b) joins as v2 (A2 decision 3)"},"prospective":{"seasons":"2026+","use":"scored live from forward-captured odds"}},"protocol_sha256":"664c42d12a2a38b0d08d8aca3ac2dc1b2c9754d6e2d752e4cae7b6a8b8715149","frozen_at_utc":"2026-09-29T19:58:33Z"}]
